{
  "schema_version": "1.0.0",
  "stage": "stage1",
  "source": {
    "annotations_file": "annotations/annotations.json",
    "videos_dir": "videos",
    "sample_manifest": "sample_manifest.json"
  },
  "videos": [
    {
      "video_id": "GX010021",
      "video_file": "videos/GX010021.MP4",
      "has_video": true,
      "has_annotation": true,
      "event_count": 55,
      "events": [
        {
          "index": 0,
          "type": "Instruction",
          "text": "Let's first preheat the oven to 350 degrees Fahrenheit.",
          "timestamp": 4.418
        },
        {
          "index": 1,
          "type": "User-Comment",
          "text": "Okay. Starting the oven to 350 Fahrenheit.",
          "timestamp": 9.608
        },
        {
          "index": 2,
          "type": "Success",
          "text": "Great Job!",
          "timestamp": 15.982
        },
        {
          "index": 3,
          "type": "Instruction",
          "text": "Get a bowl to mix the wet ingredients.",
          "timestamp": 17.0
        },
        {
          "index": 4,
          "type": "User-Comment",
          "text": "Okay.",
          "timestamp": 21.948
        },
        {
          "index": 5,
          "type": "Feedback",
          "text": "That bowl is too small. Let's get a bigger bowl.",
          "timestamp": 24.128
        },
        {
          "index": 6,
          "type": "User-Comment",
          "text": "Okay! Getting a bigger bowl.",
          "timestamp": 30.588
        },
        {
          "index": 7,
          "type": "Success",
          "text": "Great job.",
          "timestamp": 34.819
        },
        {
          "index": 8,
          "type": "Instruction",
          "text": "Now crack two eggs and add them to the bowl.",
          "timestamp": 36.658
        },
        {
          "index": 9,
          "type": "Feedback",
          "text": "You should add two eggs, not three.",
          "timestamp": 79.0
        },
        {
          "index": 10,
          "type": "User-Comment",
          "text": "Okay. I'll put the egg back.",
          "timestamp": 82.548
        },
        {
          "index": 11,
          "type": "Success",
          "text": "Great Job!",
          "timestamp": 88.0
        },
        {
          "index": 12,
          "type": "Instruction",
          "text": "Now add half a cup of sugar to the bowl.",
          "timestamp": 89.108
        },
        {
          "index": 13,
          "type": "Feedback",
          "text": "You should add more sugar. Make sure to add half cup of sugar.",
          "timestamp": 117.88
        },
        {
          "index": 14,
          "type": "User-Comment",
          "text": "Hmm, I don't want to add too much sugar.",
          "timestamp": 124.48
        },
        {
          "index": 15,
          "type": "Instruction-Clarification",
          "text": "Okay then. We will proceed with only 1/4 cup of sugar.",
          "timestamp": 127.568
        },
        {
          "index": 16,
          "type": "Success",
          "text": "Great Job!",
          "timestamp": 133.723
        },
        {
          "index": 17,
          "type": "Instruction",
          "text": "Now add half cup of milk and whisk the mixture.",
          "timestamp": 134.748
        },
        {
          "index": 18,
          "type": "User-Comment",
          "text": "Let me find half a cup.",
          "timestamp": 141.508
        },
        {
          "index": 19,
          "type": "User-Question",
          "text": "Should I use an electric whisk?",
          "timestamp": 174.418
        },
        {
          "index": 20,
          "type": "Instruction-Clarification",
          "text": "Yes, you can use an electric whisk.",
          "timestamp": 179.388
        },
        {
          "index": 21,
          "type": "User-Comment",
          "text": "Let me get it started.",
          "timestamp": 185.748
        },
        {
          "index": 22,
          "type": "Feedback",
          "text": "Keep on whisking the ingredients until they are mixed well.",
          "timestamp": 204.538
        },
        {
          "index": 23,
          "type": "User-Question",
          "text": "Do they look well mixed?",
          "timestamp": 226.458
        },
        {
          "index": 24,
          "type": "Success",
          "text": "Yes, great job.",
          "timestamp": 230.048
        },
        {
          "index": 25,
          "type": "Instruction",
          "text": "Now mix in one cup of flour.",
          "timestamp": 231.088
        },
        {
          "index": 26,
          "type": "Success",
          "text": "Good job.",
          "timestamp": 293.688
        },
        {
          "index": 27,
          "type": "Instruction",
          "text": "Next, let's put half a cup of butter in a microwave-safe bowl and melt it in the microwave.",
          "timestamp": 294.698
        },
        {
          "index": 28,
          "type": "User-Question",
          "text": "Now how do I melt it in the microwave?",
          "timestamp": 329.488
        },
        {
          "index": 29,
          "type": "Instruction-Clarification",
          "text": "Let's run the microwave in 15-second bursts and check if the butter is melted at the end of 15 seconds.",
          "timestamp": 333.708
        },
        {
          "index": 30,
          "type": "Feedback",
          "text": "Hmm, the butter is not melted yet. Let's put the bowl back in the microwave for 15 more seconds.",
          "timestamp": 397.648
        },
        {
          "index": 31,
          "type": "Success",
          "text": "Good job.",
          "timestamp": 431.658
        },
        {
          "index": 32,
          "type": "Instruction",
          "text": "Now let's whisk the cake mixture until everything is mixed well.",
          "timestamp": 432.658
        },
        {
          "index": 33,
          "type": "Feedback",
          "text": "Keep on mixing until the mixture is smooth.",
          "timestamp": 479.58
        },
        {
          "index": 34,
          "type": "Feedback",
          "text": "Keep on mixing until the mixture is smooth.",
          "timestamp": 489.74
        },
        {
          "index": 35,
          "type": "Success",
          "text": "Great job.",
          "timestamp": 525.0
        },
        {
          "index": 36,
          "type": "Instruction",
          "text": "Now let's transfer the mixture to the baking tray.",
          "timestamp": 526.0
        },
        {
          "index": 37,
          "type": "User-Question",
          "text": "Should I put it directly or do I need to um line it with something?",
          "timestamp": 531.008
        },
        {
          "index": 38,
          "type": "Instruction-Clarification",
          "text": "Use a parchment paper to line the baking tray.",
          "timestamp": 538.698
        },
        {
          "index": 39,
          "type": "User-Comment",
          "text": "I don't have a parchment paper.",
          "timestamp": 544.398
        },
        {
          "index": 40,
          "type": "Instruction-Clarification",
          "text": "You can then use some of the leftover butter from the melt to line up the tray.",
          "timestamp": 546.378
        },
        {
          "index": 41,
          "type": "User-Question",
          "text": "I don't have any leftover butter, should I use oil instead?",
          "timestamp": 552.478
        },
        {
          "index": 42,
          "type": "Instruction-Clarification",
          "text": "Yes, you can use oil.",
          "timestamp": 556.368
        },
        {
          "index": 43,
          "type": "User-Comment",
          "text": "Okay.",
          "timestamp": 557.848
        },
        {
          "index": 44,
          "type": "Success",
          "text": "Great job.",
          "timestamp": 580.0
        },
        {
          "index": 45,
          "type": "Instruction",
          "text": "Now let's transfer the mixture to the baking tray.",
          "timestamp": 581.0
        },
        {
          "index": 46,
          "type": "User-Question",
          "text": "The mixture looks a bit runny. Should I add a little bit more more flour?",
          "timestamp": 585.438
        },
        {
          "index": 47,
          "type": "Instruction-Clarification",
          "text": "As long as the mixture is smooth, you need not add more flour.",
          "timestamp": 592.658
        },
        {
          "index": 48,
          "type": "User-Comment",
          "text": "Hmm, I'll add a little bit more flour.",
          "timestamp": 597.378
        },
        {
          "index": 49,
          "type": "User-Comment",
          "text": "Okay, this looks smooth to me.",
          "timestamp": 627.298
        },
        {
          "index": 50,
          "type": "Success",
          "text": "Good job.",
          "timestamp": 629.668
        },
        {
          "index": 51,
          "type": "Instruction",
          "text": "Now let's pour the mixture into the tray.",
          "timestamp": 630.612
        },
        {
          "index": 52,
          "type": "Success",
          "text": "Good job.",
          "timestamp": 685.328
        },
        {
          "index": 53,
          "type": "Instruction",
          "text": "Now let's put the tray in the oven.",
          "timestamp": 686.478
        },
        {
          "index": 54,
          "type": "Success",
          "text": "Good job.",
          "timestamp": 692.608
        }
      ]
    },
    {
      "video_id": "GX010029",
      "video_file": "videos/GX010029.MP4",
      "has_video": true,
      "has_annotation": true,
      "event_count": 35,
      "events": [
        {
          "index": 0,
          "type": "Instruction",
          "text": "Get a large pan and put it on the stove.",
          "timestamp": 1.97
        },
        {